{
  "allowed_scope": [
    "ORDER_BOOK_DELTA_V1_CONTRACT_DEFINITION",
    "OFFLINE_SNAPSHOT_DELTA_SEQUENCE_RECONSTRUCTION",
    "STRICT_SEQUENCE_AND_PREV_SEQUENCE_VALIDATION",
    "ZERO_QUANTITY_LEVEL_DELETION",
    "NEGATIVE_QUANTITY_REJECTION",
    "GAP_DUPLICATE_REORDER_DETECTION",
    "RESYNC_REQUIRED_ON_GAP_AMBIGUOUS_DUPLICATE_OR_CHECKSUM_MISMATCH",
    "SYNCED_ONLY_RECONSTRUCTED_BOOK_PUBLICATION",
    "RECONSTRUCTED_BOOK_CHECKSUM",
    "SEQUENCE_GAP_EVENT",
    "EXACT_SNAPSHOT_PLUS_DELTA_REPLAY",
    "VERSIONED_CONFIG_AND_LINEAGE_BINDING",
    "DETERMINISTIC_STATE_AUDIT_PERSISTENCE",
    "NEGATIVE_AND_FORBIDDEN_CAPABILITY_VALIDATION",
    "FULL_CHAIN_VALIDATION_UNTIL_LOT39"
  ],
  "base_commit": "5d0695f248b1bd4e6af5621f8a3d448cc0430050",
  "canonical_roadmap": {
    "lot_id": "Lot 39",
    "source_blob_sha": "84de51bda788a8d124fb7d344419c4a4b12030b5",
    "source_line": 40,
    "source_path": "data/audit/product_scope_roadmap_lot21.jsonl",
    "title": "Order Book Delta & Sequence Reconstructor",
    "version_id": "V4_MICROSTRUCTURE_LIQUIDITY"
  },
  "current_version": "0.38.0",
  "forbidden_scope": [
    "EXTERNAL_NETWORK_ACCESS",
    "LIVE_EXCHANGE_DATA",
    "REAL_CREDENTIALS",
    "NETWORK_INGESTION",
    "BOOK_INTEGRITY_DESYNCHRONIZATION_ENGINE",
    "SPREAD_DEPTH_IMBALANCE_ANALYTICS",
    "LIQUIDITY_ZONE_WALL_VOID_INFERENCE",
    "BOOK_RESILIENCE_REPLENISHMENT_ENGINE",
    "TRADE_AGGRESSOR_CLASSIFICATION",
    "ORDER_FLOW_DELTA_CVD_ENGINE",
    "CLASSIFICATION_CONFIDENCE_ENGINE",
    "ABSORPTION_HIDDEN_LIQUIDITY_INFERENCE",
    "VOLUME_CLUSTER_TIME_AT_LEVEL_ENGINE",
    "STOP_ZONE_LIQUIDITY_POOL_INFERENCE",
    "SWEEP_FAKEOUT_TRAP_FAILED_AUCTION_ENGINE",
    "DERIVATIVES_CONTEXT_ENGINE",
    "GAME_THEORY_SCENARIO_AGGREGATION",
    "PARTICIPANT_INTENT_AS_FACT",
    "SCENARIO_TO_SIGNAL_CONVERSION",
    "FORECAST_GENERATION",
    "SIGNAL_GENERATION",
    "RISK_APPROVAL",
    "ORDER_ROUTING",
    "TRADING",
    "EXECUTION"
  ],
  "gate_status": "GO_LOT39_IMPLEMENTATION_ENTRY",
  "human_decision": "APPROVED_START_LOT39",
  "implementation_started": false,
  "next_lot": 40,
  "next_lot_status": "PLANNED_LOCKED",
  "output_checksum": "250c67574a8add382915c1b8f0b104f801bd91757c829c3d7d336f8e2e22e0ab",
  "owner": "MicrostructureDomain",
  "prerequisites": {
    "anti_flake_repetitions": 3,
    "branch_coverage_percent": 99.35,
    "latest_implemented_lot": 38,
    "line_coverage_percent": 99.61,
    "lot38_audit_checksum": "0290637591e1a8c4cd7a9975868932b65afa28fb75d6843340dbeea67a682d20",
    "lot38_book_health_checksum": "58b56f7cf21aa74dd67620b8dd6e19cad11b77412cdcc3103b6d60bd15703837",
    "lot38_config_checksum": "60899c1393e111315395dd0e149f3a468972e9e99ca5a1322b8a97ec786497db",
    "lot38_evidence_head": "ef197437d13012644e48a9044cf0883bd17700fb",
    "lot38_implementation_merge": "e4b44d27886ade86f9d1d05d480b89010b03700d",
    "lot38_post_merge_audit_merge_commit": "5d0695f248b1bd4e6af5621f8a3d448cc0430050",
    "lot38_snapshot_checksum": "0d63ca7ac1ca48b44e58c0b0f1eb8946190eaf2da6745c2bbd2dd8de14f49b16",
    "lot38_source_head": "b74bea4329d5e5cb7cf2452058b684ea5a5df13c",
    "lot38_state_checksum": "7610fc6ea73e49075a1b8611f8344c7b9c8fcf8ab02f55612d914eeac0ccda9b",
    "lot38_status": "IMPLEMENTED_VALIDATED_OFFLINE_L2_SNAPSHOT_ONLY",
    "lot39_capability_status": "PLANNED_LOCKED",
    "mutation_score_percent": 81.66,
    "order_book_snapshot_contract_name": "OrderBookSnapshotV1",
    "order_book_snapshot_schema": "contracts/schemas/order_book_snapshot_v1.schema.json",
    "planned_delta_contract_name": "OrderBookDeltaV1",
    "planned_delta_contract_schema": "contracts/schemas/order_book_delta_v1.schema.json",
    "reference_book_health_status": "HEALTHY",
    "reference_book_sequence_present": true
  },
  "quality_gates": {
    "anti_flake_repetitions": 3,
    "branch_coverage_min_percent": 90,
    "line_coverage_min_percent": 95,
    "mutation_score_min_percent": 80
  },
  "required_inputs": [
    "RunContextV1 (run_id, runtime_mode, config_version, code_commit, correlation_id)",
    "LineageEnvelopeV1 des artefacts produits par les lots préalables",
    "OrderBookSnapshotV1",
    "OrderBookDeltaV1"
  ],
  "required_outputs": [
    "OrderBookDeltaSequenceReconstructorStateV1",
    "OrderBookDeltaSequenceReconstructorAuditV1",
    "ReconstructedOrderBookV1",
    "SequenceGapEventV1"
  ],
  "runtime_mode": "OFFLINE_MICROSTRUCTURE_RESEARCH_ONLY",
  "safety": {
    "analysis_only": true,
    "approved_size": 0,
    "execution_allowed": false,
    "external_connectivity_allowed": false,
    "market_event_publication_allowed": false,
    "network_ingestion_allowed": false,
    "order_routing_allowed": false,
    "participant_behavior_inference_explicitly_labeled": true,
    "raw_data_mutation_allowed": false,
    "real_credentials_allowed": false,
    "risk_approval_allowed": false,
    "scenario_score_is_signal": false,
    "signal_generation_allowed": false,
    "trade_allowed": false,
    "used_for_decision": false
  },
  "schema_version": "lot39-v4-entry-gate-v1",
  "target_lot": 39
}
